{
 "$schema": "./model_downloads_catalog.schema.json",
 "schema": "model_downloads_catalog_v1",
 "version": "2026-10-08",
 "notes": "Curated download catalog. Sizes are bytes observed in real engine stores/caches (size_source=catalog) or null (unknown). verified=true means the artifact id was seen on a real engine or cache when the seed was built; other ids follow each engine's naming convention and are checked by presence probes and by the post-download verification in model_materializer. upstream={method, checked, revision?} records an id verified to exist upstream on that date (hf_api: HfApi.model_info(files_metadata=True), download_bytes = the weight files; ollama_registry: the registry manifest, download_bytes = the sum of its layers); such an artifact must carry its verified size. options carries route options the recommendation copies (the MTP builds: speculation). resident={bytes, source} (optional, per artifact) is the MEASURED memory the engine needs while it runs, for models whose working memory is not their file size (video generation): the fit verdict uses it instead of download_bytes, and `source` says where and at which profile it was measured. route={key, provider, model} (optional, per artifact) names the capability route that runs the artifact when its engine is not the download provider (AbstractVoice's faster-whisper runs `base`, fetched as a Hugging Face repo): what a surface shows and writes for that route, and how a route stored with the download pair is repaired (capability_defaults.repair_download_pair_routes).",
 "companion_sizes": {
  "mlx-community/Qwen3.5-4B-MTP-4bit": {
   "download_bytes": 67859512,
   "upstream": {
    "method": "hf_api",
    "checked": "2026-09-24",
    "revision": "ab6f59bc6627196c611ab8851638651078170485"
   }
  },
  "mlx-community/Qwen3.5-9B-MTP-4bit": {
   "download_bytes": 136884332,
   "upstream": {
    "method": "hf_api",
    "checked": "2026-09-24",
    "revision": "222dfd2c23fc9518d7b817e4f8e0cb0571787489"
   }
  },
  "mlx-community/Qwen3.6-27B-MTP-4bit": {
   "download_bytes": 238934137,
   "upstream": {
    "method": "hf_api",
    "checked": "2026-09-24",
    "revision": "83795d546e9d328160e593fb0bf10b2bf2fe637e"
   }
  },
  "mlx-community/Qwen3.6-35B-A3B-MTP-4bit": {
   "download_bytes": 475130833,
   "upstream": {
    "method": "hf_api",
    "checked": "2026-09-24",
    "revision": "0295b81421bf4d0fccca9a7c0fcfb1418dda3516"
   }
  },
  "mlx-community/Qwen3.8-27B-MTP-4bit": {
   "download_bytes": 238934137,
   "upstream": {
    "method": "hf_api",
    "checked": "2026-09-24",
    "revision": "b643c01b6d3b094e325edb6ebd832e16c486c575"
   }
  },
  "mlx-community/gemma-4-26B-A4B-it-qat-assistant-4bit": {
   "download_bytes": 236124704,
   "upstream": {
    "method": "hf_api",
    "checked": "2026-09-24",
    "revision": "bb94eae1b70a80dac16cbf959bb4b7d56bd1fb8c"
   }
  }
 },
 "rows": [
  {
   "id": "qwen3-0.6b",
   "family": "qwen3",
   "display_name": "Qwen3 0.6B",
   "vendor": "Qwen",
   "params_total": 600000000,
   "params_active": null,
   "license": "apache-2.0",
   "capabilities_key": "qwen3-0.6b",
   "tags": [
    "chat",
    "small",
    "thinking"
   ],
   "starter": false,
   "artifacts": [
    {
     "provider": "ollama",
     "artifact": "qwen3:0.6b",
     "quant": "q4_k_m",
     "download_bytes": null,
     "size_source": "unknown",
     "verified": false
    },
    {
     "provider": "ollama",
     "artifact": "qwen3:0.6b-q8_0",
     "quant": "q8_0",
     "download_bytes": 832291421,
     "size_source": "catalog",
     "verified": false,
     "upstream": {
      "method": "ollama_registry",
      "checked": "2026-09-24"
     }
    },
    {
     "provider": "mlx",
     "artifact": "mlx-community/Qwen3-0.6B-4bit",
     "quant": "4bit",
     "download_bytes": null,
     "size_source": "unknown",
     "verified": false
    },
    {
     "provider": "mlx",
     "artifact": "mlx-community/Qwen3-0.6B-8bit",
     "quant": "8bit",
     "download_bytes": 633442994,
     "size_source": "catalog",
     "verified": false,
     "upstream": {
      "method": "hf_api",
      "checked": "2026-09-24",
      "revision": "11de96878523501bcaa86104e3c186de07ff9068"
     }
    },
    {
     "provider": "huggingface",
     "artifact": "unsloth/Qwen3-0.6B-GGUF:Q4_K_M",
     "quant": "q4_k_m",
     "download_bytes": null,
     "size_source": "unknown",
     "verified": false
    },
    {
     "provider": "huggingface",
     "artifact": "unsloth/Qwen3-0.6B-GGUF:Q8_0",
     "quant": "q8_0",
     "download_bytes": 639447744,
     "size_source": "catalog",
     "verified": false,
     "upstream": {
      "method": "hf_api",
      "checked": "2026-09-24",
      "revision": "50968a4468ef4233ed78cd7c3de230dd1d61a56b"
     }
    }
   ]
  },
  {
   "id": "qwen3-1.7b",
   "family": "qwen3",
   "display_name": "Qwen3 1.7B",
   "vendor": "Qwen",
   "params_total": 1700000000,
   "params_active": null,
   "license": "apache-2.0",
   "capabilities_key": "qwen3-1.7b",
   "tags": [
    "chat",
    "small",
    "thinking"
   ],
   "starter": false,
   "artifacts": [
    {
     "provider": "ollama",
     "artifact": "qwen3:1.7b",
     "quant": "q4_k_m",
     "download_bytes": null,
     "size_source": "unknown",
     "verified": false
    },
    {
     "provider": "ollama",
     "artifact": "qwen3:1.7b-q8_0",
     "quant": "q8_0",
     "download_bytes": 2220102173,
     "size_source": "catalog",
     "verified": false,
     "upstream": {
      "method": "ollama_registry",
      "checked": "2026-09-24"
     }
    },
    {
     "provider": "mlx",
     "artifact": "mlx-community/Qwen3-1.7B-4bit",
     "quant": "4bit",
     "download_bytes": null,
     "size_source": "unknown",
     "verified": false
    },
    {
     "provider": "mlx",
     "artifact": "mlx-community/Qwen3-1.7B-8bit",
     "quant": "8bit",
     "download_bytes": 1828306541,
     "size_source": "catalog",
     "verified": false,
     "upstream": {
      "method": "hf_api",
      "checked": "2026-09-24",
      "revision": "8c24f6782a91421513803ce527a27dcc560ab904"
     }
    },
    {
     "provider": "huggingface",
     "artifact": "unsloth/Qwen3-1.7B-GGUF:Q4_K_M",
     "quant": "q4_k_m",
     "download_bytes": null,
     "size_source": "unknown",
     "verified": false
    },
    {
     "provider": "huggingface",
     "artifact": "unsloth/Qwen3-1.7B-GGUF:Q8_0",
     "quant": "q8_0",
     "download_bytes": 1834426944,
     "size_source": "catalog",
     "verified": false,
     "upstream": {
      "method": "hf_api",
      "checked": "2026-09-24",
      "revision": "d7f544eead698dbd1f15126ef60b45a1e1933222"
     }
    }
   ]
  },
  {
   "id": "qwen3-4b",
   "family": "qwen3",
   "display_name": "Qwen3 4B",
   "vendor": "Qwen",
   "params_total": 4000000000,
   "params_active": null,
   "license": "apache-2.0",
   "capabilities_key": "qwen3-4b",
   "tags": [
    "chat",
    "thinking"
   ],
   "starter": false,
   "artifacts": [
    {
     "provider": "ollama",
     "artifact": "qwen3:4b",
     "quant": "q4_k_m",
     "download_bytes": null,
     "size_source": "unknown",
     "verified": false
    },
    {
     "provider": "mlx",
     "artifact": "mlx-community/Qwen3-4B-4bit",
     "quant": "4bit",
     "download_bytes": null,
     "size_source": "unknown",
     "verified": false
    },
    {
     "provider": "mlx",
     "artifact": "mlx-community/Qwen3-4B-8bit",
     "quant": "8bit",
     "download_bytes": 4274158987,
     "size_source": "catalog",
     "verified": false,
     "upstream": {
      "method": "hf_api",
      "checked": "2026-09-24",
      "revision": "0348ad770d2ae658ca47b0579b2d2c37b20bbcac"
     }
    },
    {
     "provider": "huggingface",
     "artifact": "unsloth/Qwen3-4B-GGUF:Q4_K_M",
     "quant": "q4_k_m",
     "download_bytes": 2497281312,
     "size_source": "catalog",
     "verified": true
    },
    {
     "provider": "huggingface",
     "artifact": "unsloth/Qwen3-4B-GGUF:Q8_0",
     "quant": "q8_0",
     "download_bytes": 4280405792,
     "size_source": "catalog",
     "verified": false,
     "upstream": {
      "method": "hf_api",
      "checked": "2026-09-24",
      "revision": "22c9fc8a8c7700b76a1789366280a6a5a1ad1120"
     }
    }
   ]
  },
  {
   "id": "qwen3-4b-2507",
   "family": "qwen3",
   "display_name": "Qwen3 4B Instruct 2507",
   "vendor": "Qwen",
   "params_total": 4000000000,
   "params_active": null,
   "license": "apache-2.0",
   "capabilities_key": "qwen3-4b-2507",
   "tags": [
    "chat",
    "tools"
   ],
   "starter": false,
   "artifacts": [
    {
     "provider": "lmstudio",
     "artifact": "qwen/qwen3-4b-2507",
     "quant": null,
     "download_bytes": null,
     "size_source": "unknown",
     "verified": false
    },
    {
     "provider": "mlx",
     "artifact": "mlx-community/Qwen3-4B-Instruct-2507-4bit",
     "quant": "4bit",
     "download_bytes": 2278972236,
     "size_source": "catalog",
     "verified": true
    },
    {
     "provider": "mlx",
     "artifact": "mlx-community/Qwen3-4B-Instruct-2507-8bit",
     "quant": "8bit",
     "download_bytes": 4274158989,
     "size_source": "catalog",
     "verified": false,
     "upstream": {
      "method": "hf_api",
      "checked": "2026-09-24",
      "revision": "0e42af58449718de7931ee04f28191fbe6c43a56"
     }
    },
    {
     "provider": "huggingface",
     "artifact": "unsloth/Qwen3-4B-Instruct-2507-GGUF:Q4_K_M",
     "quant": "q4_k_m",
     "download_bytes": 2497281120,
     "size_source": "catalog",
     "verified": true
    },
    {
     "provider": "huggingface",
     "artifact": "unsloth/Qwen3-4B-Instruct-2507-GGUF:Q8_0",
     "quant": "q8_0",
     "download_bytes": 4280405600,
     "size_source": "catalog",
     "verified": false,
     "upstream": {
      "method": "hf_api",
      "checked": "2026-09-24",
      "revision": "a06e946bb6b655725eafa393f4a9745d460374c9"
     }
    }
   ]
  },
  {
   "id": "qwen3-8b",
   "family": "qwen3",
   "display_name": "Qwen3 8B",
   "vendor": "Qwen",